{
  "schema_version": "1.0",
  "project_id": "高教社杯全国大学生数学建模竞赛-2026",
  "status": "RUNNING",
  "current_stage": "INTAKE",
  "completed_stages": [
    "SELECTION"
  ],
  "active_thread_id": "01a08b6e-1f73-7f50-b4fe-594241a837c8",
  "next_stage": "INTAKE",
  "blocking_items": [],
  "updated_at": "2026-09-10T21:07:40+08:00"
}
